essay,score
"తెలుగు ఒక ప్రాచీన భాష. ఇది 2000 సంవత్సరాల చరిత్ర కలిగిఉంది. నన్నయ, తిక్కన, యథార్థ రాఘవ మహాను కవులు. తెలుగు సాహిత్యం గొప్పది.",8.5
"సాంకేతికం విద్యను మార్చింది. ఆన్‌లైన్ నేర్చుకోవడం కొత్త అవకాశాలు. గ్రామీణ ప్రాంతాలలో ఇంటర్నెట్ సవాలులు.",7.8
"పర్యావరణ రక్షణ ముఖ్యం. చెట్లను కొట్టడం తప్పు. నీటి కాలుష్యం నిరోధించాలి. మన భవిష్యత్తు మన చేతులలో ఉంది.",7.2
"వ్యవసాయం ఆంధ్రప్రదేశ్ వెన్నెముక. రైతులు దేశాభివృద్ధికి కారణం. ఆధునిక సాంకేతికం వ్యవసాయానికి సహాయం చేస్తుంది.",8.0
"యువత దేశం భవిష్యత్తు. విద్య మరియు ఉపాధి అవకాశాలు కావాలి. ప్రభుత్వం యువత సంక్షేమం కోసం పని చేయాలి.",7.5
